{
  "@context": {
    "@base": "https://elian0609.github.io/sensado-vehicular/id/",
    "sosa": "http://www.w3.org/ns/sosa/",
    "xsd": "http://www.w3.org/2001/XMLSchema#",
    "proy": "https://elian0609.github.io/sensado-vehicular/vocab#",
    "rdfs": "http://www.w3.org/2000/01/rdf-schema#",
    "feature_id": "@id",
    "feature_kind": "proy:featureKind",
    "description": "rdfs:comment"
  },
  "@type": "sosa:FeatureOfInterest",
  "feature_id": "ambient_air_at_device",
  "feature_kind": "aire_ambiente",
  "description": "Aire ambiente en el punto de toma del sensor, a bordo de la plataforma"
}
